{
  "schema_version": "1.0",
  "title": "Draftpine Lite final-shape implementation plan",
  "objective": "Rewrite Draftpine around the v3 page JSON, editable HTML theme, static compiler, and strict eval model without preserving v2 source compatibility.",
  "status": "complete",
  "source_files": [
    "README.md",
    "SPECIFICATION.md",
    "SPECIFICATION_v3.md",
    "docs/architecture.md",
    "docs/authoring.md",
    "draftpine-work-summary.md"
  ],
  "created_at": "2026-06-18",
  "updated_at": "2026-06-18",
  "principles": [
    "Keep the evaluator as the product differentiator; simplify authoring, not quality control.",
    "Make the default authoring model one page JSON file per route, with sections that point at editable theme blocks.",
    "Keep generated prototypes static, GitHub Pages safe, and free of bundlers, frontend frameworks, routers, and backends.",
    "Make custom blocks easy to create locally, while reserving stricter manifests and fixtures for distributable theme packages.",
    "Remove the current recipe/content/primitive/layout default model when it conflicts with the v3 page/theme/block model.",
    "Prefer explicit files and boring data over hidden framework behavior."
  ],
  "assumptions": [
    "Draftpine v3 is the default and only supported source model in this repository.",
    "Users edit pages/*.json and themes/<theme> files; prototype/ and reports/ are generated output.",
    "The TypeScript CLI, Zod schemas, Vitest tests, and Playwright eval harness remain the foundation.",
    "Legacy v2 projects must be manually re-authored as v3 pages and blocks; source compatibility is not preserved."
  ],
  "non_goals": [
    "Do not introduce React, Vue, Svelte, Tailwind, Bootstrap, a bundler, a router, or a backend runtime.",
    "Do not build a visual editor.",
    "Do not support arbitrary JavaScript execution inside block templates.",
    "Do not preserve the v2 route/recipe/content/primitive/layout source model."
  ],
  "decision_log": [
    {
      "id": "D001",
      "date": "2026-06-18",
      "decision": "Use page JSON plus editable HTML themes as the default authoring model.",
      "rationale": "The current split between routes, recipes, content, primitives, and layouts is coherent but too ceremonial for first-contact prototype work. One page file per route reduces coordination overhead while keeping output compiler-owned.",
      "implications": [
        "The default user journey shifts from editing several source files to editing pages/*.json and themes/default blocks.",
        "Compiler internals can still normalize Lite pages into the current project model where useful.",
        "Documentation and AGENTS.md must stop teaching direct root HTML editing or old Python scripts."
      ]
    },
    {
      "id": "D002",
      "date": "2026-06-18",
      "decision": "Keep blocks as external HTML partials with a tiny safe template language.",
      "rationale": "HTML partials make themes obvious to inspect and edit. A constrained Mustache-like language supports text, arrays, and conditionals without turning themes into mini applications.",
      "implications": [
        "Block authoring can be learned by opening themes/default/blocks/*.html.",
        "Template rendering must escape values by default and provide deliberate raw HTML escape hatches only if they are explicitly designed and checked.",
        "Block metadata can stay light for local themes and become stricter for published theme packs."
      ]
    },
    {
      "id": "D003",
      "date": "2026-06-18",
      "decision": "Retain strict eval as the release gate for Lite output.",
      "rationale": "Draftpine's strongest value is catching layout, accessibility, runtime, and route-safety issues after rendering. Simplifying authoring should not weaken that loop.",
      "implications": [
        "Every Lite fixture must run through generate, check, and strict eval.",
        "Theme and block changes must be evaluated through screenshots, mobile overflow checks, console error checks, labels, primary actions, and unresolved template marker checks.",
        "Reports should point back to page JSON and theme block files when possible."
      ]
    },
    {
      "id": "D004",
      "date": "2026-06-18",
      "decision": "Implement Draftpine v3 as a v3-only source model with no v2 compatibility path.",
      "rationale": "The rewrite objective explicitly rejected source compatibility and made SPECIFICATION_v3.md the contract. Removing compatibility branches keeps the compiler and docs aligned around pages, themes, blocks, prototype output, reports, and strict eval.",
      "implications": [
        "draftpine init creates pages and themes by default.",
        "draftpine generate/check/eval load pages/*.json and themes/<theme> only.",
        "Old routes, recipes, primitive manifests, layout manifests, and v2 fixtures are removed from active implementation."
      ]
    }
  ],
  "open_questions": [
    {
      "id": "Q001",
      "question": "Should Lite become schemaVersion 3.0, or should it be introduced as schemaVersion 2.1 with a source.mode field?",
      "owner": "product-engineering",
      "status": "answered",
      "resolution": "Use schemaVersion 3.0 immediately."
    },
    {
      "id": "Q002",
      "question": "Should routes remain in routes.json for multi-page projects, or can pages/*.json be discovered by convention and generate the route map?",
      "owner": "product-engineering",
      "status": "answered",
      "resolution": "Discover public routes from pages/*.json in stable priority/path order."
    },
    {
      "id": "Q003",
      "question": "How strict should local theme block metadata be before a block is considered valid?",
      "owner": "product-engineering",
      "status": "answered",
      "resolution": "Local theme block metadata requires a file and may declare required props, markers, states, and interactions."
    }
  ],
  "milestones": [
    {
      "id": "M01",
      "title": "Product cut and docs alignment",
      "description": "Lock the simpler product shape, remove stale Python/static-starter instructions from the agent path, and document the new default mental model.",
      "outcome": "A contributor or agent can understand that Draftpine Lite means page JSON, editable HTML themes, static generation, and eval.",
      "task_ids": [
        "T001",
        "T002",
        "T003"
      ]
    },
    {
      "id": "M02",
      "title": "Lite source model",
      "description": "Define, validate, and load the page-first source shape without requiring separate recipes and content files.",
      "outcome": "Draftpine can read pages/*.json and normalize them into renderable routes and sections.",
      "task_ids": [
        "T004",
        "T005",
        "T006",
        "T007"
      ]
    },
    {
      "id": "M03",
      "title": "Editable theme blocks",
      "description": "Create the theme directory contract, block metadata, safe template renderer, and default block set.",
      "outcome": "A user can edit themes/default/blocks/*.html and themes/default/styles.css, then regenerate a valid static prototype.",
      "task_ids": [
        "T008",
        "T009",
        "T010",
        "T011",
        "T012"
      ]
    },
    {
      "id": "M04",
      "title": "Compiler integration",
      "description": "Render Lite pages through the existing static output pipeline while preserving relative links, assets, shell behavior, and manifest reporting.",
      "outcome": "draftpine generate produces prototype/ output from Lite pages and theme blocks.",
      "task_ids": [
        "T013",
        "T014",
        "T015",
        "T016"
      ]
    },
    {
      "id": "M05",
      "title": "Eval and repair loop",
      "description": "Make strict eval point findings back to Lite source files and add fixtures that prove the new model catches real failures.",
      "outcome": "draftpine check and draftpine eval remain the hard gate for Lite projects.",
      "task_ids": [
        "T017",
        "T018",
        "T019",
        "T020"
      ]
    },
    {
      "id": "M06",
      "title": "Migration and release readiness",
      "description": "Provide migration tooling, compatibility guidance, docs, and release checks for the simpler default path.",
      "outcome": "Existing v2 projects can move toward Lite intentionally, and new users start in Lite by default.",
      "task_ids": [
        "T021",
        "T022",
        "T023",
        "T024",
        "T025"
      ]
    }
  ],
  "tasks": [
    {
      "id": "T001",
      "title": "Write the Draftpine Lite product brief",
      "priority": 1,
      "status": "done",
      "phase": "strategy",
      "type": "design",
      "details": "Create a short product brief that defines the final shape: pages declare intent and data, themes provide editable HTML blocks, Draftpine compiles static output, and eval remains the quality gate. The brief should explicitly state what gets simpler, what remains from v2, and what moves into an advanced layer.",
      "rationale": "The current repository has a working v2 compiler/evaluator, but the default authoring surface is larger than necessary. A crisp product brief prevents implementation from drifting into another parallel framework.",
      "steps": [
        "Add a docs/lite.md or equivalent concept document.",
        "Define the default user journey in five commands or fewer.",
        "Describe the relationship between Lite pages, themes, blocks, generated output, and eval reports.",
        "List what stays advanced-only: primitive manifests, layout manifests, extension fixtures, and deep route-type contracts.",
        "Document compatibility expectations for existing v2 projects."
      ],
      "acceptance_criteria": [
        "The brief contains a one-sentence product definition.",
        "The brief includes at least one concrete page JSON example and one theme block example.",